{
    "help_url": "https://help.crunchyroll.com/",
    "playhead_interval_ms": 30000,
    "app_legal_links": {
        "privacy_policy": "https://www.crunchyroll.com/privacy?mode=mobile",
        "terms_of_service": "https://www.crunchyroll.com/tos?mode=mobile"
    },
    "terms_of_service": {
        "last_updated_date": ""
    },
    "watch_page": {
        "version": "v1",
        "experiment_name": "",
        "variation_name": ""
    },
    "objects_max_ids_per_request_allowed": 100,
    "content_api_service": {
        "playheads_upload_batch_size": 500,
        "playheads_get_batch_size": 350
    },
    "user_benefits": {
        "fetch_interval_sec": 3600
    },
    "new_relic": {
        "is_enabled": true
    },
    "in_app_updates": {
        "is_enabled": false,
        "client_version_staleness_days": 5,
        "update_reminder_interval_sec": 2592000,
        "background_install_delay_sec": 180
    },
    "singular": {
        "is_enabled": true
    },
    "mega_fan_upgrade": {
        "version": "v1",
        "experiment_name": "",
        "experiment_id": "",
        "variation_name": "",
        "variation_id": ""
    },
    "user_interactions_tracking": {
        "is_enabled": true
    },
    "in_app_review": {
        "is_enabled": false,
        "interval_between_attempts_min": 129600,
        "app_launches_count_trigger": 5,
        "app_launches_period_trigger_min": 10080
    },
    "watch_page_rating": {
        "is_enabled": false
    },
    "content_maturity_rating": {
        "is_enabled": false
    },
    "app_resume_screens_reload_intervals": {
        "short_interval_minutes": 3,
        "medium_interval_minutes": 20,
        "long_interval_minutes": 480
    },
    "billing_notifications": {
        "is_in_grace_home_cta_enabled": false,
        "is_in_grace_notification_enabled": false,
        "is_on_hold_notification_enabled": false,
        "is_renew_notification_enabled": false,
        "experiment_name": "",
        "experiment_id": "",
        "variation_name": "",
        "variation_id": ""
    },
    "email_verification_banner": {
        "occurrence_interval_after_dismiss_minutes": 1440,
        "occurrence_interval_after_confirmation_minutes": 15
    },
    "closed_captions": {
        "is_enabled": false,
        "remote_configurable": false
    },
    "sony_music": {
        "is_enabled": false,
        "remote_configurable": false
    }
}
